{
  "id": "transatlantic_slave_trade_1500",
  "name": "Trans-Atlantic Slave Trade",
  "status": "historic",
  "period": { "start": 1501, "end": 1867 },
  "geography": {
    "region": "Atlantic / Africa / Americas",
    "coordinates": [0.0, -30.0]
  },
  "participants": {
    "perpetrators": ["European Colonial Powers", "African Slave Traders", "American Plantation Owners"],
    "victims": ["Enslaved West & Central Africans"]
  },
  "metrics": {
    "mortality": {
      "min": 1800000,
      "max": 2500000,
      "population_initial": 12500000,
      "population_loss_percent": 15.0,
      "confidence": "medium",
      "note": "Mortality refers to deaths during the Middle Passage (~12.5M embarked, ~10.7M disembarked). Does not include deaths on plantations or in African raids, which would multiply the figure significantly."
    },
    "scores": {
      "systematic_intensity": 80,
      "profit": 100,
      "ideology": 60,
      "complicity": 100
    },
    "breakdowns": {
      "systematic_intensity": {
        "policy": true,
        "state_involvement": true,
        "infrastructure": true,
        "propaganda": true,
        "broad_targeting": true,
        "cultural_ban": true,
        "property_seizure": true,
        "identification": true,
        "biological_warfare": false,
        "duration_over_5y": true
      },
      "profit": {
        "direct_revenue": true,
        "resource_extraction": true,
        "forced_labor": true,
        "economic_dependence": true,
        "market_integration": true
      },
      "ideology": {
        "purity_ideal": false,
        "historical_claim": false,
        "higher_purpose": false,
        "victim_narrative": false,
        "utopianism": false
      },
      "complicity": {
        "distance": true,
        "benefit": true,
        "euphemisms": true,
        "diffused_responsibility": true,
        "silence": true
      }
    }
  },
  "tags": ["chattel_slavery", "profit_driven", "global_trade", "middle_passage"],
  "analysis": {
    "tier": "PROFIT-DRIVEN ATTRITION",
    "pattern_note": "The definitive example of Profit-Driven Attrition. Ideology (Racism) was developed *post-hoc* to justify the economic engine. Intensity score is high due to the industrial scale of transport and legal coding of humans as property."
  },
  "sources": [
    { "title": "The Slave Trade: The Story of the Atlantic Slave Trade: 1440-1870", "author": "Hugh Thomas", "year": 1997 },
    { "title": "Trans-Atlantic Slave Trade Database", "author": "Eltis et al.", "year": 2020 }
  ]
}
